Index,Company,Job Description
27,Braintrust,"JOB TYPE: Contract to Hire Position (no agencies/C2C - see notes below)
LOCATION: Remote  United States and Canada only (TimeZone:Work anytime)
HOURLY RANGE: Our client is looking to pay $90-$120/hr
ESTIMATED DURATION: 40hr/week - Long-term
THE OPPORTUNITY
Requirements
*Please attach resume
*Contract to hire or direct hire only 
**US and Canada only
What you’ll be working on
BUILDING THE POSSIBILITIES. 
Our client is looking for a Lead Smart Contract Engineer in the Blockchain Division to be part of one of our multidisciplinary teams where you’ll work closely with designers, product managers, data analysts, and other engineering teams. You’ll be a creative contributor to our processes and decision-making so They can build and expand our blockchain infrastructure to ensure the scalability and availability of the entire platform. They’re constantly growing and forming new teams. Sound good to you? Join us.
WHAT YOU’LL DO AS A LEAD SMART CONTRACT ENGINEER:
Design, develop and improve the company’s dApps and blockchain infrastructure for different products and services to tap into. 
Contribute to agility and scalability of not just the codes but the team and engineering practices. The blockchain platform needs to efficiently support other engineering teams who roll out products and they are always looking for ways to improve our best-practices, streamline our development process, and improve team synergy! 
Research and stay current with the state-of-art of blockchain technologies.
Review codes and merge requests by junior developers, offering constructive feedback to the team. 
Ensure the wellness of our production dApps and related services, reporting bugs and issues immediately upon discovery and always look for ways to optimize tech stack and improve security.
Be active and connected in the bigger blockchain community (in a responsible way) and bring new solutions and ideas to the team!
Define security standards and procedures; educate other team members.
Provide technical leadership in the area of blockchain technology.
They’re constantly growing and forming new teams; you will have the opportunity to lead as an engineer or transition into a manager role. 
WHAT SKILLS YOU WILL USE:
3+ years of smart contract development experience in Solidity (experience in other smart contract languages is an asset). 
Strong knowledge of design principles both specific to smart contract (like factory pattern, proxy design) or more generic like OOP, functional programming, REST. 
Experience in Solidity, OpenZeppelin standards, Web3, Truffle/Hardhat, the Graph, NodeJS, AWS, MySQL/Postgres, MongoDB/NoSQL. 
Experience in leading a team in completion of projects with agile methodologies.
Experience in smart contract auditing is a strong asset.
Familiar with cryptography and encryption methods. Experience with enterprise level key management solutions or projects is a strong asset.
Ability to grow yourself and other engineers through code reviews, design reviews, and screenshare/peer debugging.
This position is remote except that it may not be performed in Colorado.
LI-AA
WHO ARE OUR CLIENT A GOOD FIT FOR? 
They love working with talented people but more than that, they seek out compassionate co-workers with a collaborative spirit. Their work moves quickly and They’re great at coming together to find creative solutions to some of tech’s most interesting problems. If that sounds good to you, join us. 
Apply Now!"
28,Syndica,"At Syndica, big things happen. Every day, we’re translating vision into reality by tackling new and exciting challenges head-on. This is a breakthrough stage in our company, and you’ll experience firsthand the infectious enthusiasm of our employees and leadership team. You’ll have the opportunity to learn new skills, grow your career, and work with the smartest, most passionate people in crypto.
This role will have the primary accountability of designing, implementing, and operating Solidity smart contracts on Solana... Yes, you read that right! Have you looked into Neon EVM?  Solidity smart contract development experience is a necessity! The team operates with a “run what you write” philosophy and each engineer is responsible for deploying and operating the code they write.
Responsibilities
Drive high-level decisions about architecture and features
Design, implement, test, and audit protocol upgrades and additions
Collaborate with full-stack and front-end developers to bring products to life
Adopt code quality processes to ensure the readability, best practices and maintainability of solidity smart contracts
Test smart contracts in  and  environments
Collaborate with other engineers to implement operational solutions while defining and adhering to industry best practices
Qualifications
Proven experience interacting with the EVM and writing high-quality, well-tested Solidity
Deep understanding of EVM, Solidity, and JavaScript
Knowledgeable about smart contract security and best practices
Experienced user of Hardhat/Truffle and Ethers.js/web3.js
Experienced user of Git version control system
Passionate about DeFi and knowledgeable about industry trends
Understanding of tokenomics and governance design
Experience working in a highly distributed company is a plus
Align a portion of your day with the business hours of Central Time Zone - UTC -6
Working knowledge of information security issues
Systematic problem-solving approach, combined with a strong sense of ownership and drive
Firm grasp of at least one modern programming language, beyond advanced scripting (Shell or Python)
Experience writing automation tools & eagerness to ""automate all the things""
What does success in this role look like?
In three months, you have become our go-to Solidity developer working on important smart contracts/programs delivering quality and thoroughly tested code. You’ll have taken on independent code review responsibilities and are collaborating on the design of new instructions/upgrades.
In six months, you have earned the trust of the team and are delivering tasks through the entire SDLC, from design through development with minimal guidance, and are helping to effectively mentor new engineers joining the team
In twelve months, you have established a cadence of predictable, on-time delivery without cutting corners"
29,Burnt Finance,"Burnt Finance is building the decentralized future for Web3 assets. For the first time, users are able to auction, mint, and trade NFTs in an entirely permissionless ecosystem. We are proud to be supported by amazing investors such as Animoca Brands, Multicoin Capital, Alameda Research, and so many more. If you’re looking to join a fast paced, problem solving environment in the center of blockchain infrastructure, NFTs, and decentralized applications, please apply!You will help build groundbreaking decentralized applications from the ground up, which will become a critical piece of architecture for the next stage of Web3 and crypto adoption.
Responsibilities:

Develop decentralized web3 infrastructure and applications
Support front-end applications and user experience
Participate in and own choices of engineering methodologies, tools and organization
Work autonomously within a high-performing team

Requirements:

4+ years of professional experience
Proven ability to write high-quality, well-tested code
Highly autonomous, strong communication and collaboration within team
Understanding of API design & implementation
Good understanding of git and continuous integration tools
Ability to take responsibility for projects and the willingness to learn and grow professionally in a team environment

Our Tech Stack:


Web: HTML, Javascript, Typescript, React, NextJS, CSS, Sass, Web3/Cosmjs

Backend: NodeJS, Typescript, GraphQL, Postgres

Web3 Platform: Cosmos-SDK (Golang), CosmWasm (Rust)

Infrastructure: AWS
As we are still a lean engineering team, we are looking for engineers willing to take on multiple roles. When applying, please include which of the following skillsets you believe you would be able to bring to the table most rapidly:1. Typescript + React2. Smart contract development3. Web3/Cosmjs4. OtherBenefits of working at Burnt Finance include competitive compensation, unlimited PTO, medical, dental, and vision insurance, company off-sites and more!Burnt Finance is proud to foster an inclusive environment that is free from discrimination. We strongly believe in order to build the best products, we need a diversity of perspectives and backgrounds. This leads to a more delightful experience for our users and team members. We value listening to every voice and we encourage everyone to come be a part of building a company and products we love."
30,Chain,"Chain is looking for a Smart Contract Auditor to join our Blockchain Team.
 
Chain is an award-winning technology company that specializes in blockchain related services and software with production ready products in the market.
 
The Security Smart Contract Auditor will review security of the various smart contracts and protocols within the DeFi ecosystem as well as provide insights in establishing best practices for security culture within the industry. This role will contribute to how security is defined when building decentralized software."
31,SW7 Group,"We seek a Solidity programmer with significant experience in auditing smart contracts. The successful applicant will bring a strong understanding of common contract exploits and how to protect against them, particularly in relation to ERC-20 tokens, upgradeable proxies, and role-based access control mechanisms.
SW7 Group focuses on Finance Technology. Their company has offices in Hong Kong and London. They have a small team that's between 11-50 employees.
You can view their website at http://www.sw7group.com"
32,Parity Technologies,"Parity Technologies builds core infrastructure for blockchains and Web 3.0 technologies. We strive to write the fastest, lightest, and safest core technology in Blockchain and write lots of open-source code.Parity works in a very flat hierarchy with lots of autonomy and high levels of personal responsibility, and we try to mimic an open-source workflow in much of what we do. We have an older article on our blog about our development practices which you may want to read.
You will be joining the Smart Contracts team, which builds core products like the ink! smart contract language or the contracts module in Substrate FRAME, but also dApps and frontend libraries to support the core projects and facilitate adoption.The role is about developing and maintaining end-to-end tooling in Typescript for our users - developers building smart contracts or smart contract chains. Our stack consists of Typescript, React, React-Redux, Rust, Docker, Cypress, Netlify, AWS, GCP
About you:
Make sure our browser-based smart contract tooling is up to date with the latest changes in Substrate and ink! and on track with the product roadmap
Collaborate with the DevOps team to ensure the availability and scaling of our apps
Actively participate in planning, suggest and drive new features and projects by identifying and interviewing stakeholders, outlining project requirements and coordinating with other teams on delivering code.
Able to deliver without any supervisory role giving you precise step-by-step instructions.
Adhere to software engineering best practices and approaches and apply them in code reviews
Technical requirements
Well versed with Typescript on the frontend and backend
Complex state management with React
Production experience with Docker and cloud services providers
Good knowledge of the blockchain space is a plus, but not a must!
Benefits 
Working at Parity means focusing on the stuff that counts: building the most cutting-edge technology for the future web. Our teams enjoy a high degree of trust, freedom, and autonomy to achieve that goal.
You will understand blockchain technology and business development and have a skill set transferable to many jobs.
Because we value initiative and learning, we've defined a generous personal budget to attend conferences or skills courses of your choosing. We think you know what's best for you!
Parity is a diverse company with people from various countries, and we will support you with German or English language courses where needed.
Not all of us who collaborate work in the same place. Bringing the team together is something we value greatly, so we regularly go on team retreats.
 
Not a perfect match to our requirements? We're happy to receive your application anyways and hear how you think you can help us achieve our mission.
To see how we use your data please see our Applicant Notice."
33,Tokemak,"Tokemak (tokemak.xyz) is a novel Web3 protocol designed to generate deep, sustainable liquidity for DeFi and future tokenized applications that will arise throughout the growth and evolution of Web3.Job Description:
We are looking for a Web3 Full-Stack developer who will be responsible for designing, implementing, and supporting Tokemak’s public API and SDK. Your primary responsibility will be to spearhead the development of Tokemak’s public API and documentation and to ensure we have a world class developer experience for users of our API.
Our ideal candidate is:
Security minded
A team player
Adaptable/flexible: enjoys doing work that requires frequent shifts in direction
Achievement-oriented: enjoys taking on challenges, even if they might fail
Innovative: prefers working in unconventional ways or on tasks that require creativity
Independent, organized, and accountable
Responsibilities:
Design, develop, maintain support and document the Tokemak API and SDK
Brainstorm and help evaluate applications for new tools and technologies as they continually evolve
Maintain and extend current API and be responsible for integration and business logic
Be involved in the global blockchain community—work on implementing and integrating the latest improvement proposals
Manage developer relations and developer support for projects that use the Tokemak API
Build comprehensive documentation, examples and tutorials for the Tokemak API
Skills:
Strong software development background (5+ years of experience)
Experience working with open-source projects
Strong knowledge of common algorithms and data structures
Experience with web3
Strong API and SDK design experience
Extensive experience with Node.js, JavaScript, and other modern web development technologies
Familiarity with Solidity or Rust"
34,Zama,"Zama's mission is to safeguard privacy by making the internet encrypted end-to-end. Zama’s products help web2 and web3 developers build private-by-design applications using homomorphic encryption (FHE), without having to learn cryptography.Zama was founded by Pascal Paillier, a pioneer in FHE, and Rand Hindi, a serial privacy entrepreneur, and has a team of veteran cryptographers, including Nigel Smart, Marc Joye, Ilaria Chillotti and others.As part of our efforts bringing privacy to web3, we are building a homomorphic blockchain protocol that enables private smart contracts, where computation happens on-chain on encrypted shared states. **Role Description**We’re looking for a Blockchain Engineer with a strong background in Layer 1 or Layer 2 blockchain protocols, capable of designing and implementing new PoS protocols that are taylored to the particularities of using homomorphic encryption. You will be working alongside a team of cryptographers, protocol designers, and full-stack engineers to design, implement and launch Zama’s homomorphic blockchain.Your job as a Blockchain Engineer will be to:- Develop and maintain the Zama blockchain.- Take part in architecture discussions.- Develop our blockchain ecosystem and work closely with partnering protocols.He / She / They should have:- Strong experience building blockchain protocols- Strong understanding of various consensus schemes (PoW, PoS, ..)- Passionate about open source and blockchain- Be a friendly team player- Be obsessed with making things that actually work for usersWe are a full remote company but you should ideally be in an European time zone.Our process is described in detail here: https://www.zama.ai/post/how-we-hire-at-zamaZama values and promotes diversity. We give everyone a fair chance to be evaluated on their mix of professional, academic, and personal skills. Our aim is to make the hiring process as pleasant, stress-free, and friendly as possible, even if the process is longer and more involved than you might find elsewhere."
