Index,Company,Job Description
7,Rand Labs,"Job Overview:
Smart Contract development at Randlabs is very different from other companies working on other blockchains. As a Smart Contract Engineer, you will develop applications using Transaction Execution Approval Language (TEAL). This activity will demand the maximum problem-solving skills and will surely overheat your brain once in a while. If you are looking to challenge yourself to solve complex problems while building the future of finance, this might be the right place for you. In this role, you can work from anywhere in the world.
 
Skills & Requirements:
+3 years of software development
+1 Smart contract development in Solidity or any other blockchain
Experience in Software security
English or Spanish (or both)
Nice to haves:
PyTEAL/TEAL experience in Algorand
Natural talent at reverse-engineering
Strong experience with low-level programming languages
Experience with assembler/assembly languages
Experience building driver
Math competition awards
Location: Remote"
8,QuillHash Technologies,"Quillhash Technologies is a pioneer in developing enterprise-grade Blockchain solutions. We help traditional businesses become more efficient, streamlined, creative, and innovative by helping them realize the potential of the latest tech - Blockchain, AI, and IoT.
We are looking for passionate smart contract auditor interns who will review smart contracts and decentralized applications for security vulnerabilities within the web3 ecosystem. Under this role, you will work with the QuillAudits team, a product by QuillHash to provide cybersecurity solutions to crypto projects and start-ups. As a result of our industry-leading and quality assuring services, we have helped 400+ projects to eliminate serious security threats and have secured $15B+ in total value locked.
https://audits.quillhash.com/
What you will do:
Review the code (primarily solidity contracts) of blockchain projects.
Identify vulnerabilities, design and architectural flaws, quality improvement, and ways to mitigate future risk.
Write clear and concise reports and “action-steps” for developers to quickly mitigate and fix any issues discovered
Provide insights in establishing best practices for security culture within the industry.
Interact with developers, and key stakeholders when identifying and handling security issues
What we are looking for:
A deep understanding of the EVM, the ETH Yellow Paper, & EVM OP_Codes
Fluency in Solidity
Experience with security CTFs, like Ethernaut, Damn Vulnerable Defi etc and Development environments like Hardhat, Truffle, etc.
Comprehensive Knowledge of Javascript OR Python is required.
Knowledge of deFi , NFT protocols .
Understanding of Smart Contract Security Principles
Why we are awesome:
Work from Home friendly and Remote working.
Professional and Personal Development.
Fitness and online course allowances.
Company Events.
5-day workdays.
Competitive Performance Bonuses.
One of the pioneer companies in the blockchain space.
Working with professionals in the heart of the blockchain industry.
Dynamic startup environment, you will learn a lot of things.
Flat organization structure with an opportunity to work very closely with the founder.
QuillHash Technologies focuses on Healthcare, Loyalty Programs, Supply Chain Management, Insurance, and Blockchains. Their company has offices in Singapore, United Kingdom, and Gurgaon. They have a small team that's between 11-50 employees.
You can view their website at https://www.quillhash.com or find them on Twitter, Facebook, LinkedIn, and Product Hunt."
9,Composable Finance,"At Composable Finance we are at the forefront of Crypto, building robust cross-chain & cross-layer infrastructure to allow the future of DeFi where almost any asset or contract can seamlessly interoperate.After 32mil Series A we're now looking for a Team Lead/Snr with proven Substrate Rust experience, who wants to lead or join a highly technical team with deep knowledge of DeFi and take it to the next level.ResponsibilitiesIf you join this role you will be able to:
Lead a development team focused on building a parachain. 
Be hands-on in development.
Manage a team of Substrate Rust developers.
Sync with Ethereum developers building other things in the space.
Requirements & skillsWe are looking for someone that:
Has proven leadership or management experience.
Is an experienced Substrate Rust developer.
Understands decentralized, high-performance systems.
Can analyze and optimize the platform’s performance.
Has experience with security audits of third-party and internal solutions.
Is interested in the Polkadot ecosystem.
Has the ability to design, research and develop blockchain-based solutions.
Understands how to improve engineering standards, tooling, and processes.
Nice to have
Substantial experience.
Familiarity with DeFi such as yearn and curve.
Ability to design algorithms and mathematical models.
Perks
Competitive Crypto payments, all made in USDC. 
100% remote work. No geographic restrictions. 
An entrepreneurial environment that encourages innovation and facilitates the growth of cutting-edge technology. 
The ability to work as an independent contractor: We treat you as your own agent and support you accordingly!
Annual Working Equipment Allowance.
Monthly Gym & Fitness Bonus
Paid Absence Days
Global WeWork membership, with access to more than 600 locations worldwide.
Annual personal development funding to facilitate career development
Diversity & Inclusion: A company commitment to equal opportunity. We do not condone discrimination on the premise of race, color, religion, sexual orientation, age, gender identity or expression."
10,Frontier,"Intro:
Join our team and work directly with the founders to build the future of Automation for the upcoming decentralized web. Enjoy a lot of perks, travel with us to cool events and participate in amazing off-side retreats with the team!
Participate in creating the most sophisticated crypto bot network ever created by designing the smart contracts that will rule them all!
We are a fully remote team and although we hire globally.
What we offer:
A fully remote team with team members in Zug, Paris, New York, Berlin, and many other cool places
Join the “Gelato Legendary Member Club” and work directly with the founders
Participate in building the infrastructure that aims to become the glue between all crypto networks and power the most promising dapps on Ethereum and beyond
Generous Token Package - Get a share of the network’s token and be able to participate in the Gelato DAO
Chance to participate in shaping the future of web3 by working together with the biggest projects in this space, such as MakerDAO, Connext, Quickswap, etc.
Worldclass Investors - We are backed by top class VCs and Angels including Dragonfly, Galaxy Digital, ParaFi, Gnosis, Stani Kulechov and many more!
Requirements:
Experience in writing smart contracts in solidity
Experience with web3 libraries (ethers.js, web3.js) - preferably ethers.js
Experience with testing your code locally and on ethereum test networks
Experience with the hardhat development environment
Experience deploying contracts to production environments like mainnet or polygon
Experience with writing subgraphs for indexing contract data
Experience using dapps like Uniswap, Aave, or Maker.
You can work with high autonomy
Strong written and verbal communication skills
Bonus:
Knowledge about the inner workings of the EVM
Mathematics & Finance Background
Experience in building and running bots that interact with smart contracts on Ethereum
Knowledge about Ethereum Client & Mining software
Front-end experience, building dApps on existing smart contracts
Technologies we use and teach:
Solidity
Node.js
Typescript
Javascript
Ethers.js
Hardhat
React
Frontier focuses on Blockchains. Their company has offices in United Kingdom. They have a small team that's between 11-50 employees.
You can view their website at https://fr0ntierx.com"
11,Parity Technologies,"About Parity
Parity Technologies builds core infrastructure for blockchains and Web 3.0 technologies. This means dealing with P2P networking, consensus algorithms, cryptography, databases, and decentralized applications. We strive to write the fastest, lightest, and safest core technology in Blockchain and write lots of open-source code. 
Parity works in a very flat hierarchy with lots of autonomy and high levels of personal responsibility, and we try to mimic an open-source workflow in much of what we do. We have an older article on our blog about our development practices which you may want to read.
 
About the position:
For this role you will be mostly working on Parity’s ink! ‒ a domain-specific language to write smart contracts in Rust for blockchains built on the Substrate framework. ink! Is an opinionated way of how we think writing smart contracts in Rust should be done. Rust has great support for WebAssembly and we make use of this by compiling ink! smart contracts to WebAssembly.
Besides the developer experience with ink! a number of other hard challenges exist. One of those is that we are constantly optimising our contracts so that they are compiled to as-small-as-possible WebAssembly blobs ‒ this is important for e.g. gas fees and transaction throughput. There is a lot of room for innovation and we’re trying hard to stay ahead of our competition.
Improving performance, integrating XCM, and most importantly, getting WebAssembly smart contracts on par with the Solidity ecosystem are some of the things on our roadmap.
You will be working with the ink! team and have a close collaboration with the people working on Substrate’s contracts module, as well as the Contracts UI ‒ a web application to deploy and interact with smart contracts.
We are a fast moving team, some of us are living in Berlin, but we’re primarily remote. We have regular team retreats in nice locations to discuss technical challenges, do hackathons, and socialise. It’s important to us that we’re all having fun along the way and we’re a humorous bunch.
To us It’s important to us that you’re “hungry” and passionate. We are primarily developers, but besides that we engage with the community, talk to teams building with ink!, answer questions in our StackExchange community, provide and maintain our own documentation and tutorials, as well as giving talks and workshops. That’s something we would like to see from you as well. 
If your prior role was as a Solidity developer or in a Developer Relations role and you’re thinking of doing more Rust ‒ this role might be just the job you have been looking for.
 
Requirements:
Experience with Rust.
Familiarity with the Rust ecosystem.
Knowledge of Bitcoin, Ethereum or other blockchain technologies.
An interest in decentralized technology and Web 3.
Nice to have:
Deep knowledge in one of the following areas is especially appreciated.
Knowledge of Solidity or other smart contract programming languages.
Experience implementing decentralized applications (Dapps), including “Layer 1” and “Layer 2” approaches..
Benefits:
Competitive salaries and benefits.
Opportunity to become an expert in the latest blockchain technologies.
Working at Parity means focusing on stuff that matters: building cutting-edge technology for a better and more decentralized internet. Our teams enjoy a high degree of freedom and autonomy to achieve that goal.
Because we value initiative and learning, we've defined a generous personal improvement budget to attend conferences or skills courses of your own choosing. We think you know what's best for you!
Parity is a diverse company with people from various countries and we will support you with German or English language courses where needed (and desired).
We have a remote-friendly company setup.
Bringing the team together is something we value a lot and we have regular company retreats (or will have, pending the Covid pandemic).
Not a perfect match to our requirements? We're happy to receive your application anyways and hear how you think you can help us achieve our mission.
To see how we use your data please see our Applicant Notice."
12,Gelato Network,"Intro:
Join our team and work directly with the founders to build the future of Automation for the upcoming decentralized web. Enjoy a lot of perks, travel with us to cool events and participate in amazing off-side retreats with the team!
Participate in creating the most sophisticated crypto bot network ever created by designing the smart contracts that will rule them all!
We are a fully remote team and although we hire globally, there is a strong preference for this role to be based in Central Europe.
Watch a short summary
What we offer:
A fully remote team with team members in Zug, Paris, New York, Berlin, and many other cool places
Join the ""Gelato Legendary Member Club"" and work directly with the founders
Participate in building the infrastructure that aims to become the glue between all crypto networks and power the most promising dapps on Ethereum and beyond
Generous Token Package - Get a share of the network's token and be able to participate in the Gelato DAO
Chance to participate in shaping the future of web3 by working together with the biggest projects in this space, such as MakerDAO, Connext, Quickswap, etc.
Worldclass Investors - We are backed by top class VCs and Angels including Dragonfly, Galaxy Digital, ParaFi, Gnosis, Stani Kulechov and many more!
Requirements
Experience in writing smart contracts in solidity
Experience with web3 libraries (ethers.js, web3.js) - preferably ethers.js
Experience with testing your code locally and on ethereum test networks
Experience with the hardhat development environment
Experience deploying contracts to production environments like mainnet or polygon
Experience with writing subgraphs for indexing contract data
Experience using dapps like Uniswap, Aave, or Maker.
You can work with high autonomy
Strong written and verbal communication skills
Bonus:
Knowledge about the inner workings of the EVM
Mathematics & Finance Background
Experience in building and running bots that interact with smart contracts on Ethereum
Knowledge about Ethereum Client & Mining software
Front-end experience, building dApps on existing smart contracts
Technologies we use and teach:
Solidity
Node.js
Typescript
Javascript
Ethers.js
Hardhat
React
Benefits
Unlimited holiday (yes you heard that right!)
Work very autonomously
Generous GEL token package
Competitive Salary
Work together with one of the best technical teams on Ethereum
Build relationships with top blockchain teams which are already Gelato users, including MakerDAO, Instadapp, Zerion, Quickswap and many more
Chance to travel the world to go to exciting events and connect with key players in this industry
Join amazing in-person offsites all over the world
Gelato Network focuses on Blockchain / Cryptocurrency. Their company has offices in Zug and Remote. They have a small team that's between 11-50 employees.
You can view their website at https://gelato.network/ or find them on Twitter."
13,Node Guardians,"Mission
Design and develop quests and missions for intermediate to advanced solidity developers. You possess the mindset and behavior of an engineer.
Collaborate cross-functionally with everyone
Find the right balance between progress (i.e. shipping quickly) and perfection (i.e. measuring twice).
Works at a rapid pace with a large amount of ownership and autonomy
You’ll help us to think about how to create web3 connected, powerful user experiences for our growing community
Your Profile
Ideally, previous production-level smart contract experience
Fast learner
Track record of high quality, well-crafted code that has been used in production environments.
You bring in strong communication skills in English (written and spoken)
Good knowledge of Solidity development patterns and best practice
Experience with smart contract development tools and frameworks
Ability to apply high quality testing standards and good documentation practices
You’ve spent your teenage years on Age of Empires II
Solid understanding of EVM
Good grasp of software engineering principles
Pragmatic and autonomous
You don’t meet all the requirements? Don’t sweat it, we are constantly looking for talent with passion, grit and integrity. You are encouraged to apply even if your experience doesn’t precisely match the job description. Your skills and drive will stand out and set you apart.
If this sounds like an environment you would thrive in, please send your cover letter demonstrating why you would succeed in this role and current CV to us at [email protected]
Node Guardians values your time hence our interview cycle is concise & respectful :)
Node Guardians focuses on Blockchain / Cryptocurrency. Their company has offices in Dubai and Remote. They have a small team that's between 1-10 employees.
You can view their website at https://twitter.com/nodeguardians"
14,Mirana,"Responsibilities Participate in backend projects based on DeFi projects Participate in the innovation and research and development of DeFi projects Participate in research and survey of blockchain forward-looking projects and fields Planning architecture for smart contracts with optimization patterns and data structures for blockchain environment. Developing new and engineering smart contracts for financial protocols on Ethereum blockchain Bachelor's degree in Computer Science, Engineering or similar experience Self-study / research in relevant projects will would be advantageous for this role, minor training & guidance will be provided. Prior experience in blockchain, finance, banking, consultancy or forex trading is an additional advantageous Have research and understanding of basic public chain projects (Ethereum/Solana/Cosmos/Rust) etc. In-depth understanding of Ethereum smart contract solidity and its development framework, truffle, hardhat Familiar with the principles of mainstream DeFi protocols ( uniswap v2/v3/compound/aave ) Good to have backend frameworks ( express, nestjs, typeorm etc. ) skills. Possess good learning ability, communication ability and analytical problem solving ability. What you can expect: Fast-paced, result-oriented environment Exposure to the latest market insights Supportive team and open culture Competitive Remuneration Regular Team Bonding Energetic & Fun Environment Flexi Working Hour Overtime Meal & Transport"
15,Gelato Network,"Intro:
Join our team and work directly with the founders to build the future of Automation for the upcoming decentralized web. Enjoy a lot of perks, travel with us to cool events and participate in amazing off-side retreats with the team!
Participate in creating the most sophisticated crypto bot network ever created by designing the smart contracts that will rule them all!
We are a fully remote team and although we hire globally, there is a strong preference for this role to be based in Central Europe.
Watch a short summary
What we offer:
A fully remote team with team members in Zug, Paris, New York, Berlin, and many other cool places
Join the ""Gelato Legendary Member Club"" and work directly with the founders
Participate in building the infrastructure that aims to become the glue between all crypto networks and power the most promising dapps on Ethereum and beyond
Generous Token Package - Get a share of the network's token and be able to participate in the Gelato DAO
Chance to participate in shaping the future of web3 by working together with the biggest projects in this space, such as MakerDAO, Connext, Quickswap, etc.
Worldclass Investors - We are backed by top class VCs and Angels including Dragonfly, Galaxy Digital, ParaFi, Gnosis, Stani Kulechov and many more!
Requirements
Requirements:
Experience in writing smart contracts in solidity
Experience with web3 libraries (ethers.js, web3.js) - preferably ethers.js
Experience with testing your code locally and on ethereum test networks
Experience with the hardhat development environment
Experience deploying contracts to production environments like mainnet or polygon
Experience with writing subgraphs for indexing contract data
Experience using dapps like Uniswap, Aave, or Maker.
You can work with high autonomy
Strong written and verbal communication skills
Bonus:
Knowledge about the inner workings of the EVM
Mathematics & Finance Background
Experience in building and running bots that interact with smart contracts on Ethereum
Knowledge about Ethereum Client & Mining software
Front-end experience, building dApps on existing smart contracts
Technologies we use and teach:
Solidity
Node.js
Typescript
Javascript
Ethers.js
Hardhat
React
Benefits
Unlimited holiday (yes you heard that right!)
Work very autonomously
Generous GEL token package
Competitive Salary
Work together with one of the best technical teams on Ethereum
Build relationships with top blockchain teams which are already Gelato users, including MakerDAO, Instadapp, Zerion, Quickswap and many more
Chance to travel the world to go to exciting events and connect with key players in this industry
Join amazing in-person offsites all over the world
Gelato Network focuses on Blockchain / Cryptocurrency. Their company has offices in Zug and Remote. They have a small team that's between 11-50 employees.
You can view their website at https://gelato.network/ or find them on Twitter."
16,HEXENS Cyber Security,"Hexens.io is looking for a Smart Contract Auditor to join their team. Hexens.io is a company that provides state-of-the-art cybersecurity services with an essential focus on blockchain. The company solves sophisticated issues for customers with codes containing multimillion assets.
Job responsibilities:
Review smart contracts and analyze security measures
Audit smart contracts following the highest security industry standards
Mentor and educate engineers internally on the security best practices
You are security-minded and aware of the pitfalls of EVM code and vulnerable flows.
Review code (primarily solidity smart contracts) of blockchain projects.
Work to identify vulnerabilities, design and architectural flaws, quality improvement, and ways to mitigate future risk.
Deliver clear and concise reports and “action-items” for developers to quickly mitigate and fix any issues discovered.
Interact with developers, and key stakeholders when identifying and handling security issues.
Other related responsibilities.
Required qualifications (optional):
At least 2 years of work experience in cybersecurity
Experience with JavaScript/TypeScript
Demonstrated expertise with Solidity, EVM and blockchain specifics.
Experience assessing smart contract security risks.
Experience with unit and integration testing.
Experience with hardhat and geth or other development frameworks and local environments.
Fuzzing and formal verification.
Experience developing and building on DeFi protocols and smart contracts is a big plus.
Proactive problem solver.
Benefits:
Possibility to work alongside industry-leading specialists.
Highly competitive salary.
Corporate lunches.
Great work environment.
Relocation package to Yerevan, Armenia.
To apply to this position, please send your CVs to [email protected] including the position title “Smart Contract Auditor” in the subject line.
HEXENS Cyber Security focuses on Cyber Security and Blockchain / Cryptocurrency. Their company has offices in London. They have a small team that's between 11-50 employees.
You can view their website at https://hexens.io"
